{
  "schemaVersion": 1,
  "generatedAt": "2026-10-13T20:15:00.000Z",
  "dateLabel": "Wed · Oct 14 2026",
  "items": [
    {
      "id": "s1",
      "sport": "soccer",
      "status": "upcoming",
      "event": "Champions League MD3: Bayern Munich vs Arsenal",
      "line": "Sky Sports lists Arsenal vs Bayern as the standout Matchday 3 tie, 20:00 UK time on Oct 21 (the page does not name a time zone, so JST assumes BST). Venue/home side is unclear in the listing.",
      "whenJst": "Thu Oct 22 · 04:00 JST",
      "sources": [
        {
          "name": "Sky Sports",
          "title": "Champions League 2026/27 fixtures, dates, schedule, format and who has qualified from Premier League and around Europe",
          "url": "https://skysports.com/football/news/11667/13578265/champions-league-2026-27-fixtures-dates-schedule-format-and-who-has-qualified-from-premier-league-and-around-europe"
        }
      ]
    },
    {
      "id": "s2",
      "sport": "tennis",
      "status": "live",
      "event": "Shanghai Masters quarter-finals (ATP 1000)",
      "line": "Zverev (1), de Minaur (9), Arthur Gea and Davidovich Fokina (25) have reached the quarter-finals; Sinner is out injured. Final is Oct 18. Exact match times were not published.",
      "whenJst": "Thu Oct 15 · Quarter-finals (times TBC, JST)",
      "sources": [
        {
          "name": "ATP Tour",
          "title": "Shanghai 2026 results",
          "url": "https://www.atptour.com/en/news/shanghai-2026-results"
        }
      ]
    }
  ]
}
